{
  "id": "TASK-SAMPLE-001",
  "objective": "Demonstrate a valid structured task fixture",
  "status": "PENDING",
  "classification": ["PLANNING"],
  "execution_depth": "L1",
  "dependencies": [],
  "inputs": [],
  "outputs": [],
  "evidence": [],
  "approvals": [],
  "verification": [],
  "domain_classification": {
    "status": "PARTIAL",
    "facets": {
      "capability": [{
        "id": "classification.capability.planning",
        "taxonomy": "taxonomy.atlas-capability-skos",
        "code": "capability.planning",
        "label": "Planning",
        "version": "current-official",
        "source": "spec/classification.yaml"
      }]
    },
    "taxonomy_references": ["taxonomy.atlas-capability-skos"],
    "risk_flags": [],
    "unresolved_facets": ["lifecycle-stage"],
    "conditional_candidates": [],
    "evidence": [],
    "next_action": "Clarify the lifecycle stage before selecting domain frameworks."
  },
  "domain_alignment": {
    "domains": ["planning"],
    "status": "RESEARCH_REQUIRED",
    "frameworks": [],
    "applicability": {},
    "deviations": [],
    "compliance": "UNVERIFIED",
    "evidence": []
  }
}

